{
  "schema_version": "execution_admission_v1",
  "admission_id": "S02-MVP-C2-MAPS-BUILDER-r001-8",
  "action": "builder",
  "target": "core/core-frontend/src/views/chart/components/js/panel/charts/map/point-fallback.ts",
  "goal": {
    "path": "Dashboard/Artifacts/DT_DM-478391 【2026年8月】仪表盘-功能优化合集/S02-F01/Goal.final.json",
    "sha256": "9368cbbd96fd81b44006d72ec9bcdd94b60fbb69812c3f31c65e366bf1956e53"
  },
  "completion_contract": {
    "path": "Dashboard/Artifacts/DT_DM-478391 【2026年8月】仪表盘-功能优化合集/S02-F01/MVP-20261027/UiIntegrationCases-r002.json",
    "sha256": "e365ef111582ef84f20f26e6136854409b7fc66bb0931cae40a9df5318036d55"
  },
  "context": {
    "path": "Dashboard/Artifacts/DT_DM-478391 【2026年8月】仪表盘-功能优化合集/S02-F01/planning/ContextBootstrap-S02-MVP-C2-MAPS-BUILDER-r001.json",
    "sha256": "0e6459d5b0fe671c2820f4131efb3c4e09b9cda89efa86cddccdf9628f729771"
  },
  "design_review": {
    "path": "Dashboard/Artifacts/DT_DM-478391 【2026年8月】仪表盘-功能优化合集/S02-F01/MVP-20261027/reviews/UiIntegrationDesignReview-r003-C234.md",
    "sha256": "5d4c26ebda1ba9847e19ea1d04caa82d26a54cee01685a167d8313aa3114f4b2"
  },
  "topology": {
    "path": "Dashboard/Artifacts/DT_DM-478391 【2026年8月】仪表盘-功能优化合集/S02-F01/planning/Topology-actual-r439.json",
    "sha256": "99271ea5517566fc32210302ba741750a0493a799bba53e799fec2e013775d51"
  },
  "issued_at": "2026-10-27T05:37:23.870014+00:00",
  "status": "approved"
}
