{
  "schema_version": "execution_admission_v1",
  "admission_id": "DEEXEC016-TCO-R005",
  "action": "builder",
  "target": ".kym-tco/dataease/tco/models/tco-r001.json",
  "issued_at": "2026-10-15T02:45:52.193920+00:00",
  "status": "approved",
  "goal": {
    "path": "Dashboard/Artifacts/DEEXEC016-TCO-r005/raw-intent.md",
    "sha256": "43ab80d6d4c3b8bdf6d240d9c334d3e2fb52e01d22d3398cf2788fef0773b606"
  },
  "completion_contract": {
    "path": "Dashboard/Artifacts/DEEXEC016-TCO-r005/design.md",
    "sha256": "2677427c4a700512ddddb437e4fa7e7520d0a964705b59dde6adc057a06d616c"
  },
  "context": {
    "path": "Dashboard/Artifacts/DEEXEC016-TCO-r005/design.md",
    "sha256": "2677427c4a700512ddddb437e4fa7e7520d0a964705b59dde6adc057a06d616c"
  },
  "design_review": {
    "path": "Dashboard/Artifacts/DEEXEC016-TCO-r005/design.md",
    "sha256": "2677427c4a700512ddddb437e4fa7e7520d0a964705b59dde6adc057a06d616c"
  },
  "topology": {
    "path": "Dashboard/Artifacts/DEEXEC016-TCO-r005/topology.json",
    "sha256": "a414b25493110f3d563f373027a452a6ccdb90b1b09f23acafe0925fba6fd0c2"
  }
}