{
  "schema_version": "execution_admission_v1",
  "admission_id": "S02-MVP-BUBBLE-TEST-r001",
  "action": "builder",
  "target": "core/core-frontend/tests/filter-copy-mvp-maps/check-dot-loaded-r001.mjs",
  "goal": {
    "path": "Dashboard/Artifacts/DT_DM-478391 【2026年8月】仪表盘-功能优化合集/S02-F01/Goal.final.json",
    "sha256": "4db931a6764a8c48345e7e8358e579550a9bc98594bf1654647716d72b9678c4"
  },
  "completion_contract": {
    "path": "Dashboard/Artifacts/DT_DM-478391 【2026年8月】仪表盘-功能优化合集/S02-F01/MVP-20261027/BubbleMapReadyRepairDesign-r003.md",
    "sha256": "56777f0a67f48261c6efe133994aa0723ecee65e9dc715a2390cf806f2387ac6"
  },
  "context": {
    "path": "Dashboard/Artifacts/DT_DM-478391 【2026年8月】仪表盘-功能优化合集/S02-F01/planning/ContextBootstrap-BubbleReadyTest-r001.json",
    "sha256": "630d249a4de248f651341ab9c6ecbf03fcb4d507f1201023d31321a84593a97c"
  },
  "design_review": {
    "path": "Dashboard/Artifacts/DT_DM-478391 【2026年8月】仪表盘-功能优化合集/S02-F01/MVP-20261027/reviews/BubbleMapReadyRepairReview-r003.md",
    "sha256": "db0dcfc66c34fd204bdf232a5966a71b6225191f36a67df479f3159d60111965"
  },
  "topology": {
    "path": "Dashboard/Artifacts/DT_DM-478391 【2026年8月】仪表盘-功能优化合集/S02-F01/planning/Topology-actual-r508.json",
    "sha256": "341ab38804628d8e89d178e812f6190480768c281c402f0b7fab77f965d9ba38"
  },
  "issued_at": "2026-10-29T09:16:29.569246+00:00",
  "status": "approved"
}
