{
  "schema_version": "execution_admission_v1",
  "admission_id": "S02-QPP-PREPARATION-builder-r001",
  "action": "builder",
  "target": "core/core-frontend/src/custom-component/filter-copy/query-product-paste-preparation.ts|core/core-frontend/tests/filter-copy-query-reference/query-product-paste-preparation.test.ts|Dashboard/Artifacts/DT_DM-478391 【2026年8月】仪表盘-功能优化合集/S02-F01/planning/evidence/QPP-PREPARATION-BuilderEvidence-r001.md",
  "goal": {
    "path": "Dashboard/Artifacts/DT_DM-478391 【2026年8月】仪表盘-功能优化合集/S02-F01/Goal.final.json",
    "sha256": "f562da2eb14b84dc8083e138dd2eb8718a58041f01d08163eddf5fb2c71daef0"
  },
  "completion_contract": {
    "path": "Dashboard/Artifacts/DT_DM-478391 【2026年8月】仪表盘-功能优化合集/S02-F01/QueryProductPastePreparationContract-r001.json",
    "sha256": "28e7caa0f4e0e4f2ccd54717cfc7b2fd761e252548ec1ddbf03ad2fad01053ea"
  },
  "context": {
    "path": "Dashboard/Artifacts/DT_DM-478391 【2026年8月】仪表盘-功能优化合集/S02-F01/planning/ContextBootstrap-QPP-PREPARATION-builder-r001.json",
    "sha256": "22c4baec350c0d8b51186a2762cf36cd31f04f792d84cf3242068a45e7b2dc64"
  },
  "design_review": {
    "path": "Dashboard/Artifacts/DT_DM-478391 【2026年8月】仪表盘-功能优化合集/S02-F01/reviews/QueryProductPastePreparationDesignReview-r006.md",
    "sha256": "f8b3625a4f601ba7e5e5896ea2732cb48836bf224b609f92c3c63e1ad859ceaa"
  },
  "topology": {
    "path": "Dashboard/Artifacts/DT_DM-478391 【2026年8月】仪表盘-功能优化合集/S02-F01/planning/Topology-actual-r172.json",
    "sha256": "33d458a9cc171cba452156aafaac48cd2479f26c0b6521513c6d406d7fb0218a"
  },
  "issued_at": "2026-10-20T11:14:23+00:00",
  "status": "approved"
}
