{
  "schema_version": "execution_admission_v1",
  "admission_id": "S02-ST-SRC-006-source-handler-evidence-closeout-r001",
  "action": "builder",
  "target": "Dashboard/Artifacts/DT_DM-478391 【2026年8月】仪表盘-功能优化合集/S02-F01/planning/evidence/ST-SRC-006-SOURCE-HANDLER-HARNESS-r001.md",
  "goal": {
    "path": "Dashboard/Artifacts/DT_DM-478391 【2026年8月】仪表盘-功能优化合集/S02-F01/Goal.final.json",
    "sha256": "f562da2eb14b84dc8083e138dd2eb8718a58041f01d08163eddf5fb2c71daef0"
  },
  "completion_contract": {
    "path": "Dashboard/Artifacts/DT_DM-478391 【2026年8月】仪表盘-功能优化合集/S02-F01/ST-SRC-006-SourceHandlerHarnessContract-frozen-r001.json",
    "sha256": "4a1597dbd33ca71791df5584ec4ad1883b8eb956db67f0394763c697803d5329"
  },
  "context": {
    "path": "Dashboard/Artifacts/DT_DM-478391 【2026年8月】仪表盘-功能优化合集/S02-F01/planning/ContextBootstrap-ST-SRC-006-source-handler-evidence-closeout-r001.json",
    "sha256": "f02bfab8a4e579add08067841f21b5c7f7127a6b36f0d86efa8136b75f50c579"
  },
  "design_review": {
    "path": "Dashboard/Artifacts/DT_DM-478391 【2026年8月】仪表盘-功能优化合集/S02-F01/reviews/ST-SRC-006-SourceHandlerHarnessDesignReview-r003.md",
    "sha256": "2cb9d1913a9197e134234b60649bb0e1729260731ef837a4deffd4b7599a01f2"
  },
  "topology": {
    "path": "Dashboard/Artifacts/DT_DM-478391 【2026年8月】仪表盘-功能优化合集/S02-F01/planning/Topology-actual-r303.json",
    "sha256": "e0172ef4e5f5805b25b09ad499b83b7d5fbb46c811f79f2fe67a44e2364755f7"
  },
  "issued_at": "2026-10-20T20:18:30Z",
  "status": "approved"
}
