{
  "schema_version": "execution_admission_v1",
  "admission_id": "S02-QSSDH-OBS-ASYNC-PUREMODEL-builder-r001-test",
  "action": "builder",
  "target": "core/core-frontend/tests/filter-copy-query-reference/query-single-select-observation-async.test.ts",
  "goal": {
    "path": "Dashboard/Artifacts/DT_DM-478391 【2026年8月】仪表盘-功能优化合集/S02-F01/Goal.final.json",
    "sha256": "f562da2eb14b84dc8083e138dd2eb8718a58041f01d08163eddf5fb2c71daef0"
  },
  "completion_contract": {
    "path": "Dashboard/Artifacts/DT_DM-478391 【2026年8月】仪表盘-功能优化合集/S02-F01/QuerySingleSelectObservationAsyncPureModelContract-r001.json",
    "sha256": "e791593aef2d3e3fdc2f303d011c40914672cf63c4722ffc439974e9e15184be"
  },
  "context": {
    "path": "Dashboard/Artifacts/DT_DM-478391 【2026年8月】仪表盘-功能优化合集/S02-F01/planning/ContextBootstrap-QSSDH-OBS-ASYNC-PUREMODEL-builder-r001.json",
    "sha256": "c768f197cf99fd8de627ec4da993e892e7ce315bc83a592d01d8fd404e4f1572"
  },
  "design_review": {
    "path": "Dashboard/Artifacts/DT_DM-478391 【2026年8月】仪表盘-功能优化合集/S02-F01/reviews/QuerySingleSelectObservationResolutionDeltaReview-r003.md",
    "sha256": "cefa9f01fff8517e8b1cd0160c14f35dee82d0ed7ba3f436838ae39e97d9d0cd"
  },
  "topology": {
    "path": "Dashboard/Artifacts/DT_DM-478391 【2026年8月】仪表盘-功能优化合集/S02-F01/planning/Topology-actual-r124.json",
    "sha256": "6e455fff02150b8825bf138894976278021c52c3243c53715ea58930372fe970"
  },
  "issued_at": "2026-10-18T00:00:00Z",
  "status": "approved"
}
