{
  "schema_version": "execution_admission_v1",
  "admission_id": "S02-MVP-UI-SLICE-B-API-BUILDER-r001-3",
  "action": "builder",
  "target": "Dashboard/Artifacts/DT_DM-478391 【2026年8月】仪表盘-功能优化合集/S02-F01/MVP-20261027/evidence/SliceBApiOutcome-r001.md",
  "goal": {
    "path": "Dashboard/Artifacts/DT_DM-478391 【2026年8月】仪表盘-功能优化合集/S02-F01/Goal.final.json",
    "sha256": "9368cbbd96fd81b44006d72ec9bcdd94b60fbb69812c3f31c65e366bf1956e53"
  },
  "completion_contract": {
    "path": "Dashboard/Artifacts/DT_DM-478391 【2026年8月】仪表盘-功能优化合集/S02-F01/MVP-20261027/UiIntegrationCases-r001.json",
    "sha256": "cdc9eb077f3651c2fa0f810de08f7ec85a1ba7a2ec3a5f66661cd90859f8750e"
  },
  "context": {
    "path": "Dashboard/Artifacts/DT_DM-478391 【2026年8月】仪表盘-功能优化合集/S02-F01/planning/ContextBootstrap-S02-MVP-UI-SLICE-B-API-BUILDER-r001.json",
    "sha256": "2862af268ba9c87db4e90553e13c4aa88695e0761e786da102dac9f1c25f3f41"
  },
  "design_review": {
    "path": "Dashboard/Artifacts/DT_DM-478391 【2026年8月】仪表盘-功能优化合集/S02-F01/MVP-20261027/reviews/UiIntegrationDesignReview-r001.md",
    "sha256": "670549656ea584b74b77af77638ec3717d68281f37a4e3ed2e6bb7c1e993fd03"
  },
  "topology": {
    "path": "Dashboard/Artifacts/DT_DM-478391 【2026年8月】仪表盘-功能优化合集/S02-F01/planning/Topology-actual-r427.json",
    "sha256": "59192d6cb201dcb975dede94ac99421d7412cfa0575d2e621fa2226b53328fe7"
  },
  "issued_at": "2026-10-27T03:58:30.429927+00:00",
  "status": "approved"
}
