{
  "schema_version": "execution_admission_v1",
  "admission_id": "S02-BIDIRECTIONAL-BAR-MISSING-COLUMNS-RUNTIME-r001",
  "action": "builder",
  "target": "local://127.0.0.1:7070/dataeasev3/S02_MVP_Runtime_20261027",
  "goal": {
    "path": "Dashboard/Artifacts/DT_DM-478391 【2026年8月】仪表盘-功能优化合集/S02-F01/Goal.final.json",
    "sha256": "4db931a6764a8c48345e7e8358e579550a9bc98594bf1654647716d72b9678c4"
  },
  "completion_contract": {
    "path": "Dashboard/Artifacts/DT_DM-478391 【2026年8月】仪表盘-功能优化合集/S02-F01/MVP-20261027/UiIntegrationCases-r002.json",
    "sha256": "e365ef111582ef84f20f26e6136854409b7fc66bb0931cae40a9df5318036d55"
  },
  "context": {
    "path": "Dashboard/Artifacts/DT_DM-478391 【2026年8月】仪表盘-功能优化合集/S02-F01/planning/ContextBootstrap-BidirectionalBarMissingColumnsRuntime-r001.json",
    "sha256": "9961e49d6074afbd3474b729d07fe1da1ce50d6e457c473510195a161c8f2f43"
  },
  "design_review": {
    "path": "Dashboard/Artifacts/DT_DM-478391 【2026年8月】仪表盘-功能优化合集/S02-F01/MVP-20261027/reviews/UiIntegrationDesignReview-r003-C234.md",
    "sha256": "5d4c26ebda1ba9847e19ea1d04caa82d26a54cee01685a167d8313aa3114f4b2"
  },
  "topology": {
    "path": "Dashboard/Artifacts/DT_DM-478391 【2026年8月】仪表盘-功能优化合集/S02-F01/planning/Topology-actual-r578.json",
    "sha256": "7163e3e63e80d03f77db2009cf376e6e4c5830becb2a3437676f61f05169ab2d"
  },
  "issued_at": "2026-10-30T19:28:52.477305+00:00",
  "status": "approved"
}
