{
  "schema_version": "execution_admission_v1",
  "admission_id": "S02-MVP-DEV-VALIDATION-FLAG-r001-0",
  "action": "builder",
  "target": "core/core-frontend/.env.dev.local",
  "goal": {
    "path": "Dashboard/Artifacts/DT_DM-478391 【2026年8月】仪表盘-功能优化合集/S02-F01/Goal.final.json",
    "sha256": "9368cbbd96fd81b44006d72ec9bcdd94b60fbb69812c3f31c65e366bf1956e53"
  },
  "completion_contract": {
    "path": "Dashboard/Artifacts/DT_DM-478391 【2026年8月】仪表盘-功能优化合集/S02-F01/MVP-20261027/UiIntegrationCases-r001.json",
    "sha256": "cdc9eb077f3651c2fa0f810de08f7ec85a1ba7a2ec3a5f66661cd90859f8750e"
  },
  "context": {
    "path": "Dashboard/Artifacts/DT_DM-478391 【2026年8月】仪表盘-功能优化合集/S02-F01/planning/ContextBootstrap-S02-MVP-DEV-VALIDATION-FLAG-r001.json",
    "sha256": "e7f0ff5b437bbd696d6dce9513e9389a43d9073521442a42e6359eaa5a322cdd"
  },
  "design_review": {
    "path": "Dashboard/Artifacts/DT_DM-478391 【2026年8月】仪表盘-功能优化合集/S02-F01/MVP-20261027/reviews/UiIntegrationDesignReview-r001.md",
    "sha256": "670549656ea584b74b77af77638ec3717d68281f37a4e3ed2e6bb7c1e993fd03"
  },
  "topology": {
    "path": "Dashboard/Artifacts/DT_DM-478391 【2026年8月】仪表盘-功能优化合集/S02-F01/planning/Topology-actual-r430.json",
    "sha256": "7c8dd42de2a2b917d0741cd9284064751b29105d2e344d764dd25c747d7082b4"
  },
  "issued_at": "2026-10-27T04:15:32.161132+00:00",
  "status": "approved"
}
