{
  "schema_version": "execution_admission_v1",
  "admission_id": "S02-QPREP-002-fresh-evidence-builder-r001",
  "action": "builder",
  "target": "core/core-frontend/tests/filter-copy-query-reference/query-reference-plan.test.ts",
  "goal": {
    "path": "Dashboard/Artifacts/DT_DM-478391 【2026年8月】仪表盘-功能优化合集/S02-F01/Goal.final.json",
    "sha256": "f562da2eb14b84dc8083e138dd2eb8718a58041f01d08163eddf5fb2c71daef0"
  },
  "completion_contract": {
    "path": "Dashboard/Artifacts/DT_DM-478391 【2026年8月】仪表盘-功能优化合集/S02-F01/QueryAdapterDesignConsolidationFixtures-r001.json",
    "sha256": "08ed4a0c6ef376230baf856dd7cb0a9b6254733c318b914dbcea959bdc7dd915"
  },
  "context": {
    "path": "Dashboard/Artifacts/DT_DM-478391 【2026年8月】仪表盘-功能优化合集/S02-F01/planning/ContextBootstrap-QPREP-002-builder-r001.json",
    "sha256": "16714e8e35d00e8018df751137ed0a6c42c9e4d4e4ed615880e9910e7bb117ba"
  },
  "design_review": {
    "path": "Dashboard/Artifacts/DT_DM-478391 【2026年8月】仪表盘-功能优化合集/S02-F01/reviews/QueryAdapterDesignConsolidationReview-r001.md",
    "sha256": "c761633b315dde7463c635999dcdf34a14941c1fe56804e1148acdc2aa789c61"
  },
  "topology": {
    "path": "Dashboard/Artifacts/DT_DM-478391 【2026年8月】仪表盘-功能优化合集/S02-F01/planning/Topology-actual-r052.json",
    "sha256": "cab2afd333188e82227fa01d3d7ac933e8b97ca7a6466862221d664638ff0e8d"
  },
  "issued_at": "2026-10-18T05:44:03+00:00",
  "status": "approved"
}
