{
  "schema_version": "execution_admission_v1",
  "admission_id": "TCO-SAFARI-DISPLAY-FIX",
  "action": "builder",
  "target": ".kym-tco/dataease/reports/tco-r001-support/index.html",
  "issued_at": "2026-10-15T03:06:04.405447+00:00",
  "status": "approved",
  "goal": {
    "path": "Dashboard/Artifacts/DEEXEC016-TCO-r005/safari-fix/repair-contract.md",
    "sha256": "c19fdf597bce29b420f89d2469d98fc26c3950719353683ddd88669ffce2dc93"
  },
  "completion_contract": {
    "path": "Dashboard/Artifacts/DEEXEC016-TCO-r005/safari-fix/repair-contract.md",
    "sha256": "c19fdf597bce29b420f89d2469d98fc26c3950719353683ddd88669ffce2dc93"
  },
  "context": {
    "path": "Dashboard/Artifacts/DEEXEC016-TCO-r005/safari-fix/repair-contract.md",
    "sha256": "c19fdf597bce29b420f89d2469d98fc26c3950719353683ddd88669ffce2dc93"
  },
  "design_review": {
    "path": "Dashboard/Artifacts/DEEXEC016-TCO-r005/safari-fix/repair-contract.md",
    "sha256": "c19fdf597bce29b420f89d2469d98fc26c3950719353683ddd88669ffce2dc93"
  },
  "topology": {
    "path": "Dashboard/Artifacts/DEEXEC016-TCO-r005/safari-fix/repair-contract.md",
    "sha256": "c19fdf597bce29b420f89d2469d98fc26c3950719353683ddd88669ffce2dc93"
  }
}