{
  "schema_version": "execution_admission_v1",
  "admission_id": "S02-NORMAL-LOGOUT-CLEAR-r002",
  "action": "builder",
  "target": "local://127.0.0.1:7070/dataeasev3/S02_MVP_Runtime_20261027/explicit-normal-logout-context",
  "goal": {
    "path": "Dashboard/Artifacts/DT_DM-478391 【2026年8月】仪表盘-功能优化合集/S02-F01/Goal.final.json",
    "sha256": "4db931a6764a8c48345e7e8358e579550a9bc98594bf1654647716d72b9678c4"
  },
  "completion_contract": {
    "path": "Dashboard/Artifacts/DT_DM-478391 【2026年8月】仪表盘-功能优化合集/S02-F01/MVP-20261027/UiIntegrationCases-r002.json",
    "sha256": "e365ef111582ef84f20f26e6136854409b7fc66bb0931cae40a9df5318036d55"
  },
  "context": {
    "path": "Dashboard/Artifacts/DT_DM-478391 【2026年8月】仪表盘-功能优化合集/S02-F01/planning/ContextBootstrap-LogoutClear-r002.json",
    "sha256": "cd343b24c4bcb4bb8b71479abcff8facc56ab045901338281f703b88fe4eb7b0"
  },
  "design_review": {
    "path": "Dashboard/Artifacts/DT_DM-478391 【2026年8月】仪表盘-功能优化合集/S02-F01/MVP-20261027/reviews/MvpAcceptanceReadinessReview-r002.md",
    "sha256": "d3f97246db43f9dc705829d94ede73891694b13f21f7f3a9f4a03d748574fbe7"
  },
  "topology": {
    "path": "Dashboard/Artifacts/DT_DM-478391 【2026年8月】仪表盘-功能优化合集/S02-F01/planning/Topology-actual-r593.json",
    "sha256": "f8d4e7ccb5689f91f6c80848fd604f7bd7e39669b58c7a55a0bc6522889c635f"
  },
  "issued_at": "2026-10-30T22:32:24.092474+00:00",
  "status": "approved"
}
