{
  "schema_version": "execution_admission_v1",
  "admission_id": "S02-S2-CANONICAL-PAGINATION-r001",
  "action": "builder",
  "target": "local://127.0.0.1:7070/dataeasev3/S02_MVP_Runtime_20261027",
  "goal": {
    "path": "Dashboard/Artifacts/DT_DM-478391 【2026年8月】仪表盘-功能优化合集/S02-F01/Goal.final.json",
    "sha256": "4db931a6764a8c48345e7e8358e579550a9bc98594bf1654647716d72b9678c4"
  },
  "completion_contract": {
    "path": "Dashboard/Artifacts/DT_DM-478391 【2026年8月】仪表盘-功能优化合集/S02-F01/MVP-20261027/UiIntegrationCases-r002.json",
    "sha256": "e365ef111582ef84f20f26e6136854409b7fc66bb0931cae40a9df5318036d55"
  },
  "context": {
    "path": "Dashboard/Artifacts/DT_DM-478391 【2026年8月】仪表盘-功能优化合集/S02-F01/planning/ContextBootstrap-S2CanonicalPagination-r001.json",
    "sha256": "4cb20dd8d92893c2f6287d98ce9bfe66a32249476f3688d7c59d51e62fc8b81c"
  },
  "design_review": {
    "path": "Dashboard/Artifacts/DT_DM-478391 【2026年8月】仪表盘-功能优化合集/S02-F01/MVP-20261027/reviews/MvpAcceptanceReadinessReview-r002.md",
    "sha256": "d3f97246db43f9dc705829d94ede73891694b13f21f7f3a9f4a03d748574fbe7"
  },
  "topology": {
    "path": "Dashboard/Artifacts/DT_DM-478391 【2026年8月】仪表盘-功能优化合集/S02-F01/planning/Topology-actual-r581.json",
    "sha256": "228ff62795c40a0b1b926f4026818270baa7877fd80a2b1eea31eeeccf722346"
  },
  "issued_at": "2026-10-30T21:02:59.731698+00:00",
  "status": "approved"
}
