{
  "schema_version": "execution_admission_v1",
  "admission_id": "S02-MVP-C1-RENDERER-BUILDER-r001-0",
  "action": "builder",
  "target": "core/core-frontend/src/views/chart/components/views/components/ChartComponentG2Plot.vue",
  "goal": {
    "path": "Dashboard/Artifacts/DT_DM-478391 【2026年8月】仪表盘-功能优化合集/S02-F01/Goal.final.json",
    "sha256": "9368cbbd96fd81b44006d72ec9bcdd94b60fbb69812c3f31c65e366bf1956e53"
  },
  "completion_contract": {
    "path": "Dashboard/Artifacts/DT_DM-478391 【2026年8月】仪表盘-功能优化合集/S02-F01/MVP-20261027/UiIntegrationCases-r002.json",
    "sha256": "e365ef111582ef84f20f26e6136854409b7fc66bb0931cae40a9df5318036d55"
  },
  "context": {
    "path": "Dashboard/Artifacts/DT_DM-478391 【2026年8月】仪表盘-功能优化合集/S02-F01/planning/ContextBootstrap-S02-MVP-C1-RENDERER-BUILDER-r001.json",
    "sha256": "da1c6fa7659775dfe7b91b002062610683969e94ac9bbec08e2845f2461674f4"
  },
  "design_review": {
    "path": "Dashboard/Artifacts/DT_DM-478391 【2026年8月】仪表盘-功能优化合集/S02-F01/MVP-20261027/reviews/UiIntegrationDesignReview-r002.md",
    "sha256": "3a56a82c67fc4f68c93d9f2097c79c7a6a70a284a61f522470255a16988a8357"
  },
  "topology": {
    "path": "Dashboard/Artifacts/DT_DM-478391 【2026年8月】仪表盘-功能优化合集/S02-F01/planning/Topology-actual-r434.json",
    "sha256": "dcffbef040e93d7e6386cac95aa48e1bd35a39526fa87b8b178ef4414e3ca087"
  },
  "issued_at": "2026-10-27T04:49:22.785529+00:00",
  "status": "approved"
}
