{
  "schema_version": "execution_admission_v1",
  "admission_id": "S02-MVP-PICTURE-RESOURCE-RUNTIME-r002",
  "action": "builder",
  "target": "http://127.0.0.1:7070/#/dashboard?resourceId=1312476889213964288",
  "goal": {
    "path": "Dashboard/Artifacts/DT_DM-478391 【2026年8月】仪表盘-功能优化合集/S02-F01/Goal.final.json",
    "sha256": "4db931a6764a8c48345e7e8358e579550a9bc98594bf1654647716d72b9678c4"
  },
  "completion_contract": {
    "path": "Dashboard/Artifacts/DT_DM-478391 【2026年8月】仪表盘-功能优化合集/S02-F01/MVP-20261027/PictureResourceReadyCases-r002.json",
    "sha256": "689f4fde0605ac36f951ba62cc25bec9b02c8a8f349272f194c30a1d23eaf9f8"
  },
  "context": {
    "path": "Dashboard/Artifacts/DT_DM-478391 【2026年8月】仪表盘-功能优化合集/S02-F01/planning/ContextBootstrap-S02-MVP-PICTURE-RESOURCE-RUNTIME-r002.json",
    "sha256": "1c5a21e6a5d11ee7a23b260ddb07fa0e9cf6384bc72dbf6b0a303d2c1d169351"
  },
  "design_review": {
    "path": "Dashboard/Artifacts/DT_DM-478391 【2026年8月】仪表盘-功能优化合集/S02-F01/MVP-20261027/reviews/PictureResourceReadyDesignReview-r002.md",
    "sha256": "2e90135f91ce5ae8681c0138b44f87f8145dfc58d868d3da528ee3a1b787d2e3"
  },
  "topology": {
    "path": "Dashboard/Artifacts/DT_DM-478391 【2026年8月】仪表盘-功能优化合集/S02-F01/planning/Topology-actual-r501.json",
    "sha256": "02dceae56e868b2e7639920ca3a53bce8ed175f3fb7482844f55492e169111e5"
  },
  "issued_at": "2026-10-29T07:35:51.536122+00:00",
  "status": "approved"
}