{
  "schema_version": "execution_admission_v1",
  "admission_id": "S02-CIRCLE-PACKING-MISSING-COLUMNS-RUNTIME-r001",
  "action": "builder",
  "target": "local://127.0.0.1:7070/dataeasev3/S02_MVP_Runtime_20261027",
  "goal": {
    "path": "Dashboard/Artifacts/DT_DM-478391 【2026年8月】仪表盘-功能优化合集/S02-F01/Goal.final.json",
    "sha256": "4db931a6764a8c48345e7e8358e579550a9bc98594bf1654647716d72b9678c4"
  },
  "completion_contract": {
    "path": "Dashboard/Artifacts/DT_DM-478391 【2026年8月】仪表盘-功能优化合集/S02-F01/MVP-20261027/UiIntegrationCases-r002.json",
    "sha256": "e365ef111582ef84f20f26e6136854409b7fc66bb0931cae40a9df5318036d55"
  },
  "context": {
    "path": "Dashboard/Artifacts/DT_DM-478391 【2026年8月】仪表盘-功能优化合集/S02-F01/planning/ContextBootstrap-CirclePackingMissingColumnsRuntime-r001.json",
    "sha256": "9da73cff9f1d6fb38b4fb8f05b42e2ee0ce4eb751735ee83884dbf2460716f06"
  },
  "design_review": {
    "path": "Dashboard/Artifacts/DT_DM-478391 【2026年8月】仪表盘-功能优化合集/S02-F01/MVP-20261027/reviews/UiIntegrationDesignReview-r003-C234.md",
    "sha256": "5d4c26ebda1ba9847e19ea1d04caa82d26a54cee01685a167d8313aa3114f4b2"
  },
  "topology": {
    "path": "Dashboard/Artifacts/DT_DM-478391 【2026年8月】仪表盘-功能优化合集/S02-F01/planning/Topology-actual-r574.json",
    "sha256": "ae94415311da84c84989f93cb16c26d6db7fcdc0052498d7b49718a0b2f352e5"
  },
  "issued_at": "2026-10-30T18:14:13.668331+00:00",
  "status": "approved"
}
