{
  "schema_version": "execution_admission_v1",
  "admission_id": "G2-OWNERSHIP-BROWSER-FIXTURE-r001-0",
  "action": "builder",
  "target": "core/core-frontend/tests/g2-render-ownership/browser",
  "goal": {
    "path": "Dashboard/Artifacts/DT_DM-478391 【2026年8月】仪表盘-功能优化合集/S02-F01/Goal.final.json",
    "sha256": "28c94d3c35d4ce0a891ce77ecc915932d67f88ef813f3d2815dc0dce11f91b64"
  },
  "completion_contract": {
    "path": "Dashboard/Artifacts/DT_DM-478391 【2026年8月】仪表盘-功能优化合集/S02-F01/G2StageLifecycleOwnershipCases-r003.json",
    "sha256": "b8844f51bed1f0574215210003ad1d59831c75635f9b0b6ed091baf3b78bbfe7"
  },
  "context": {
    "path": "Dashboard/Artifacts/DT_DM-478391 【2026年8月】仪表盘-功能优化合集/S02-F01/planning/ContextBootstrap-G2-OWNERSHIP-BROWSER-FIXTURE-r001.json",
    "sha256": "2689244e04c3c026466787f2abfd3f6ad92c11576f7f425c143aa8bdcbaf8045"
  },
  "design_review": {
    "path": "Dashboard/Artifacts/DT_DM-478391 【2026年8月】仪表盘-功能优化合集/S02-F01/reviews/G2StageLifecycleOwnershipDesignReview-r003.md",
    "sha256": "c386d4ad6ab5fc55c4bfa276b8dbcee9afb85e464cc136b1cbb9e9b5871163aa"
  },
  "topology": {
    "path": "Dashboard/Artifacts/DT_DM-478391 【2026年8月】仪表盘-功能优化合集/S02-F01/planning/Topology-actual-r393.json",
    "sha256": "41bec0dff974813bac9b69c1d78ef558b432854d200d5c71a8cf50139528b27d"
  },
  "issued_at": "2026-10-27T00:49:58.719703+00:00",
  "status": "approved"
}
