{
  "schema_version": "execution_admission_v1",
  "admission_id": "S02-MVP-C2-LOCAL-REPAIR-r001-4",
  "action": "builder",
  "target": "Dashboard/Artifacts/DT_DM-478391 【2026年8月】仪表盘-功能优化合集/S02-F01/MVP-20261027/evidence/C2LocalRepair-r001.md",
  "goal": {
    "path": "Dashboard/Artifacts/DT_DM-478391 【2026年8月】仪表盘-功能优化合集/S02-F01/Goal.final.json",
    "sha256": "9368cbbd96fd81b44006d72ec9bcdd94b60fbb69812c3f31c65e366bf1956e53"
  },
  "completion_contract": {
    "path": "Dashboard/Artifacts/DT_DM-478391 【2026年8月】仪表盘-功能优化合集/S02-F01/MVP-20261027/UiIntegrationCases-r002.json",
    "sha256": "e365ef111582ef84f20f26e6136854409b7fc66bb0931cae40a9df5318036d55"
  },
  "context": {
    "path": "Dashboard/Artifacts/DT_DM-478391 【2026年8月】仪表盘-功能优化合集/S02-F01/planning/ContextBootstrap-S02-MVP-C2-LOCAL-REPAIR-r001.json",
    "sha256": "e6df1e52ab10570f275bc6666b301ae2ed09d76ab0b23b229506bcb76196da4f"
  },
  "design_review": {
    "path": "Dashboard/Artifacts/DT_DM-478391 【2026年8月】仪表盘-功能优化合集/S02-F01/MVP-20261027/reviews/UiIntegrationDesignReview-r003-C234.md",
    "sha256": "5d4c26ebda1ba9847e19ea1d04caa82d26a54cee01685a167d8313aa3114f4b2"
  },
  "topology": {
    "path": "Dashboard/Artifacts/DT_DM-478391 【2026年8月】仪表盘-功能优化合集/S02-F01/planning/Topology-actual-r453.json",
    "sha256": "9b753af936c6bc2d08f308df904146e87790f26490f94495006ad62c371d9ce1"
  },
  "issued_at": "2026-10-27T06:43:17.421141+00:00",
  "status": "approved"
}
